С сильным не борись, а с богатым не тяжись 	Съ сильнымъ не борись, а съ богатымъ не тяжись.Коза съ волкомъ тягалась, рога да копыта остались.Кобылка съ волкомъ тягалась, только хвостъ да грива у ней осталась.Мышкѣ съ кошкой все накладъ играть.Ср. Какъ-же, обидишь? Разбилъ мнѣ лѣто-сь морду, такъ и осталось. Съ богатымъ не судись, видно.Гр. Л. Н. Толстой. Воскресеніе. 2, 2.Ср. Возьмите (гостинецъ), — сказалъ онъ: исторію себѣ наживете. Съ сильнымъ не борись! и пословица такъ говоритъ. Еще скажутъ, что вы кобянитесь... кушайте на здоровье! Не нами это заведено, не нами и кончится.Салтыковъ.
Мелочи жизни. 2, 1. Сельская учительница.Ср. Mit grossen Herrn ist nicht gut Kirschen essen.Ср. C’est folie de manger cerises avec seigneurs.Car ils prennent toujours les plus meures.Gabr. Meurier. Sent. XVI s.Ср. Qui avec son seigneur mange poires, il ne choisit pas des meilleurs.Prov. Communs. XV в.Ср. Majori cedo.Пер. Передъ сильнѣйшимъ отступаю (уступаю).Ср. Cedere majori virtutis fama secunda.Illa gravis palma est, quam minor hostis habet.Уступать сильнѣйшему, какъ бы легкая слава,Та тяжелая слава, которая дается слабейшему врагу.Martial. De Spectaculis. 31.Ср. Cum principe non pugnandum.Ср. Pauli Manutii Adagia. 1603.Ср. Не ссорься съ человѣкомъ сильнымъ, чтобы когда-нибудь не попасться въ его руки. Не заводи тяжбы съ человѣкомъ богатымъ, чтобъ онъ не имѣлъ перевѣса надъ тобою.І. Сирах. 8. 1, 2.См. Сила по силе — осилишь, а сила не под силу — осядешь. См. Не нами это началось, не нами и кончится. См. Коротки ноги у миноги под небо лезть. См. Пальма первенства.
С собакой ляжешь, с блохами встанешь 	Съ собакой ляжешь, съ блохами встанешь.Ср. Wer mit Hunden schlafen geht, steht mit Flöhen auf.Ср. Hantez les chiens, vous aurez des puces.Eutrapel. Contes. Fol. 99.См. Беседы злые — тлят обычаи благие. См. С кем живешь, тем и слывешь.
С собственным запахом 	Съ собственнымъ запахомъ (какъ Гоголевскій Петрушка).Ср. Петрушка имѣлъ два обыкновенія: спать не раздѣваясь, и носить всегда съ собой какой-то свой особенный воздухъ своего «собственнаго запаха».Гоголь. Мертвыя души. 1, 2.Ср. Cette première pièce exhale une odeur sans nom dans la langue, et qu’il faut appeler «odeur de pension bourgeoise». Peut-être pourrait-elle se décrire, si l’on inventait un procedé pour évaluer les quantités élémentaires et nauséabondes qu’y jettent les atmosphères catarrhales et sui generis de chaque pensionnaire, jeune ou vieux.Balzac. Le Père Goriot.См. В своем роде.
С суконным рылом, да в калачный ряд 	Съ суконнымъ (мякиннымъ) рыломъ, да въ калачный рядъ (намекъ на суконную сотню въ Новгородѣ, на суконниковъ и торговцевъ сукномъ).Ср. Я человѣкъ бѣдный... кабы жениться, я... не прочь. Да... не съ нашимъ рыломъ да въ калачный рядъ.Островскій. Семейная картина.Ср. Не суйся, дуракъ, съ суконнымъ рыломъ въ калачный рядъ чай пить.Салтыковъ. Благонамѣренныя рѣчи. 5.Ср. Необходимость памятовать, что съ суконнымъ рыломъ нельзя соваться въ калачный рядъ — эта такая жестокая необходимость.Салтыковъ. За рубежемъ. 2.См. Все в струне, по струнке ходить. См. Рылом не вышел, не подходит. См. Где нам дуракам чай пить!. См. Куда нам с посконным рылом да в суконный ряд!.
С тобой разговориться, что меду напиться 	Съ тобой разговориться, что меду напиться.Ср. Рѣчь сладкая какъ медъ изъ устъ его текла.Крыловъ. Прихожанинъ.Ср. Ex cujus lingua melle dulcior fluebat oratio.Пер. Съ языка его рѣчь слаще меда текла.Cicer. De senectute. 10, 31.Ср. Τοῦ καὶ ἀπὸ γλώσσης μέλιτος γλυκίων ῥέεν αὐδή.Изъ устъ его (Нестора) рѣчь сладчайшая меда текла.Hom. Il. 1, 249. Пер. Гнѣдичъ.См. Нестор. См. На словах медок, а на сердце ледок. См. Слаще меду.
С того света 	Съ того свѣта (иноск. ирон.) — о человѣкѣ, не похожемъ на обыкновеннаго живого человѣка.Ср. Ну, балъ. Ну, Фамусовъ! умѣлъ, гостей назвать!Какіе-то уроды съ того свѣта,И не съ кѣмъ говорить, и не съ кѣмъ танцовать.Грибоѣдовъ. Горе отъ ума. 4, 1.См. На том свете.
С треском 	Съ трескомъ — во всю!Ср. Съ градомъ (арм.) — до поту градомъ.Ср. Я пріѣхалъ... сюда для веселья... Желаю я разгуляться и чтобы съ трескомъ... понятно? Сто цѣлковыхъ брошу, но, чтобы былъ отдыхъ душѣ. Чтобы вихрь былъ!М. Горькій. Тоска. 2.Ср. Кутимъ! Съ трескомъ! Эхъ ты, жизнь!Тамъ же.
С триумфом 	Съ тріумфомъ (иноск.) торжественно.Ср. Вошелъ въ вагонъ (безъ билета) и сѣлъ: проѣхали двѣ станціи, меня съ тріумфомъ выгнали.М. Горькій. Проходимецъ. 2.Ср. Triumphus (triumphare) тріумфъ, — торжество, торжественное шествіе.θρίαμβος — шествіе въ честь Вакка. (θηρ — дикій звѣрь. ἀμ(φι) βαίνων, — Ваккъ шествующій на львахъ (во время торжества).
С ума сходить 	Съ ума сходить (отъ кого) иноск. восторгаться, увлекаться до невмѣняемости, потерять голову.Ср. Иные чудаки — отъ одной этой походки съ ума сходили. «Эта женщина, когда идетъ къ тебѣ, точно все счастіе твоей жизни тебѣ на встрѣчу несетъ», говаривалъ одинъ изъ нихъ.Тургеневъ. Вешнія воды. 34.
С ума сходить, своротить, спятить(ся) 	Съ ума сходить, своротить, спятить — спятиться (иноск.) ума лишиться, помѣшаться въ умѣ.Ср. ......И у окнаСидитъ она... и все она!Онъ такъ привыкъ теряться въ этомъ,Что чуть съ ума не своротилъ.А. С. Пушкинъ. Евгеній Онѣгинъ. 8, 37—38.Ср. Какъ только она пріѣхала ко мнѣ, такъ сейчасъ-же съ ума спятила.Писемскій. Мѣщане. 3, 10.См. Тронуться. См. Взбеситься. См. Ума лишиться. См. Потерять голову. См. Свести с ума.
С умом людей бояться 	Съ умомъ людей бояться.Ср. Такъ многіе, хоть стыдно имъ признаться,Съ умомъ людей боятсяИ терпятъ при себѣ охотнѣй дураковъ.Крыловъ. Бритвы.Ср. «Такъ вы не знаете», сказалъ оселъ,Ушами хлопая, «чѣмъ могъ онъ полюбиться?...А я такъ отгадалъ —Безъ длинныхъ бы ушей онъ въ милость не попалъ».Крыловъ. Слонъ въ случаѣ.Ср. Охъ, братецъ, признаюсь,Что бритвы очень тупы!Какъ этого не знать? вѣдь мы не такъ ужъ глупы;Да острыми-то я порѣзаться боюсь.Крыловъ. Бритвы.Ср. He thinks to much, such men are dangerous.Пер. Онъ слишкомъ много думаетъ, такіе люди опасны.Shakespeare. Jul. Cæsar. 1, 2. Cæsar.См. Владеть. См. Глупый умного не любит.
С хвоста хомута не наденешь 	Съ хвоста хомута не надѣнешь (иноск.) — о начинающихъ съ конца.Ср. Brider son cheval par la queue.Le Roux. Dictionn. comique. 3.
С хвостиком 	Съ хвостикомъ (иноск.) слишкомъ, съ лишкомъ, съ прибавкой.Ср. «У него сто тысячъ съ хвостикомъ».Ср. Она тебѣ не пара: ей не двадцать четыре а... тридцать шесть съ хвостикомъ.Макаровъ. Воспоминанія. 4, 2, 14.Ср. Было уже ей лѣтъ сорокъ, можетъ даже и съ хвостикомъ.Григоровичъ. Въ ожиданіи парома. 2.Ср. Благодаримъ... а чтобъ еще пятьдесятъ лѣтъ маяться — отъ этого уже увольте! — «Нѣтъ, нѣтъ, нѣтъ! Пятьдесятъ лѣтъ да еще съ хвостикомъ!» настаиваютъ пирующіе.Салтыковъ. Сборникъ. Сонъ въ лѣтнюю ночь.Ср. Ей можно было датъ лѣтъ тридцать съ хвостикомъ, — съ самымъ маленькимъ хвостикомъ впрочемъ.Маркевичъ. Въ окна.Ср. Das hat der Fuchs gemessen (und den Schwanz zugegeben).Пер. Лиса мѣрила это и хвостъ свой прибавила (такъ что вышло больше).(Говорится между прочимъ о разстояніи, которое дальше, чѣмъ предполагаютъ)
С хлеба(на воду) на квас(перебиваться) 	Съ хлѣба (на воду) на квасъ (перебиваться) — нуждаться, жить въ скудости.Ср. Часомъ съ квасомъ, порою съ водою.Ср. Мы перебивались съ хлѣба на воду и всѣ трое ощущали вполнѣ естественное и законное въ такомъ положеніи недовольство нашей судьбой.М. Горькій. Дѣло съ застежками.Ср. Съ хлѣба на квасъ перебиваемся. Это ничего...П. Боборыкинъ. На ущербѣ. 1, 2.Ср. Живетъ бѣдно: какъ говорится съ хлѣба на квасъ...Салтыковъ. Пестрыя письма. 4.См. С пуговки на петельку перебиваться.
С хлебом съесть 	Съ хлѣбомъ съѣсть можно (иноск.) легко сбыть (легко пережевать, проглотить, переварить).См. Эту беду можно с хлебом съесть.
С человеком тихо! 	Съ человѣкомъ тихо! (иноск. шут.) не видать человѣка (намекъ на биржевое слово тихо, нѣтъ дѣлъ — спроса, предложенія).Ср. Весь жизненный горизонтъ заставленъ такъ-называемыми вопросами, проектами и т. п., но холодомъ пустого погреба несетъ отъ нихъ... человѣка не видать за ними: не видать его души, его мученій, страданій, недоумѣній, желаній... Загроможденъ горизонтъ вопросами, но всѣ они съужены до размѣровъ рубль серебромъ, всѣ они не освѣщены, не согрѣты и не соединены другъ съ другомъ мыслью о томъ существѣ, которое въ зоологіи называется «человѣкомъ»... Да и вообще, говоря биржевымъ словомъ, «съ человѣкомъ тихо», и вниманіе къ нему — превратилось въ нуль.Глѣбъ Успенскій. Богъ грѣхамъ терпитъ. Съ человѣкомъ тихо.Ср. Съ хлопкомъ, съ мукой тихо (бирж.) — безъ спроса и предложенія, безъ дѣла.См. Рубль. См. Горизонт. См. Новые горизонты открылись.
С чем вас и поздравляю! 	Съ чѣмъ васъ и поздравляю! (иноск. шут. ирон.) когда нѣтъ повода, или по поводу непріятнаго извѣстія и событія.Ср. Вы исполнили свой долгъ, лягушка, съ чѣмъ васъ и поздравляю. Затѣмъ живите смирно, никого не трогайте и васъ никто не тронетъ.Салтыковъ. Современная идиллія. 20.Ср. Графъ Малевскій показывалъ намъ разные карточные фокусы и кончилъ тѣмъ, что перетасовавши карты, сдалъ себѣ въ вистъ всѣ козыри, съ чѣмъ Лушинъ «имѣлъ честь его поздравить».Тургеневъ. Первая любовь.См. У праздника быть.
С чувством, с толком, с расстановкой 	Съ чувствомъ, съ толкомъ, съ разстановкой.Ср. Подлая сволочь глотала ихъ жадно.Подлая сволочь?.. о, нѣтъ!Все что богато, чиновно, парадно,Кушало съ чувствомъ и толкомъ обѣдъ.Некрасовъ. Папаша.Ср. Петрушка! вѣчно ты съ обновкой, —Съ разодраннымъ локтемъ! Достань-ка календарь.Читай, не такъ, какъ пономарь,А съ чувствомъ, съ толкомъ, съ разстановкой.Грибоѣдовъ. Горе отъ ума. 2, 1. Фамусовъ.См. Парад.
С чужого голоса петь 	Съ чужого голоса пѣть (иноск.) говорить что говорятъ другія, повторять чужія слова.Ср. Опять какая-нибудь новая мода; опять затянулъ ты новую арію съ чужого голоса!...Дружининъ. Замѣтки Петерб. туриста. 3, 11.Ср. Почему утверждаешь, что она самозванка, авантюрьерка? Объяснись, — прибавилъ онъ (Орловъ), сѣвъ на скамью; съ чужого голоса говоришь, или убѣдился лично.Данилевскій. Княжна Тараканова. 1, 8.Ср. On fait dire aux cloches tout ce qu’on veut.Какъ достигнуть царствія небеснаго? спросилъ богатый крестьянинъ монаха; этотъ отвѣтилъ ему словами катихизиса своего монастыря: Audite campanas monasterii: dando, dando, dando. Слушайте колокола монастыря: давая, давая, давая (латинское — звукоподраженіе).См. Сорока. См. Авантюрист.
С чужого коня среди грязи долой 	Съ чужого коня среди грязи долой.Ср. Аще кто всядетъ на чужъ конь, не прошавъ, ино ему три гривны.Русская Правда (1018 г.).
С эпиграмматической краткостью 	Съ эпиграмматической краткостью (иноск.) въ возможно краткой формѣ (намекъ на эпиграмму — стихотвореніе, отличающееся краткостью).Ср. Съ эпиграмматическою краткостью ученіе о правѣ сильнаго выражено въ словахъ, которыя Плутархъ приписываетъ Бренну. Господство сильнаго обозначаетъ словами πρεσβύτας τῶν νόομων.Iellinek. Право современнаго государства.См. Эпиграмма. См. Горе побежденным. См. Положить свой меч на весы. См. Чья сильнее, та правее.
С языка сорвалось 	Съ языка сорвалось (иноск.) объ обмолвкѣ — о противъ воли сказанномъ.Обмолвка не обида.На обмолвку поправка.Ср. Я ужъ давно забылъ (что я самъ литераторъ)... Это горькое воспоминаніе сорвалось съ моего языка...Салтыковъ. Круглый годъ. 1-ое марта.Ср. Pardon! Выраженіе: «мелочи» — сорвалось у меня съ языка. Въ сущности я отнюдь не считаю своего «дѣла» мелочью.Салтыковъ. Мелочи жизни. 2, 4.Ср. И не думалъ, въ головѣ не было (отдать ему имѣніе). Разъ какъ-то съ языка сорвалось, вотъ и пошло гулять мое слово.Достоевскій. Село Степанчиково. 1, 2.Ср. Il vaut mieux glisser du pied que de la langue.Ср. Lapsus linguae — обмолвка.Ср. Lingua lapsa verum dicit.Пер. Съ языка сорвалось — такъ правда.Erasm.Ср. Satius est equo labi quam lingua.Ср. Преткновеніе отъ земли лучше, нежели отъ языка.І. Сирах. 20, 18.См. Описка.
С-оника 	Съ-оника (ошибочно — вмѣсто — соника въ смыслѣ «тотчасъ».Ср. Вы, кажется, съ-оника, на меня особенный штандъ-пунктъ имѣете...Боборыкинъ. Измѣнникъ. 9.Ср. Ему сейчасъ-же съ-оника былъ предложенъ человѣкъ для этого способный и готовый.Лѣсковъ. Загадочный человѣкъ. 6.Ср. Чиновники-карьеристы... обладаютъ чрезвычайнымъ чутьемъ и замѣчательной подвижностью, которая дозволяетъ имъ вездѣ попадаться въ глаза, такъ сказать, съ-оника.Салтыковъ. Благонамѣренныя рѣчи. 7.Ср. Вы это какъ же, Антонина Дмитріевна, началъ съ-оника Сусальцевъ, — во Флоренцію собираетесь.Маркевичъ. Бездна. 1, 8.Ср. Она поманила къ себѣ рукою Гришу, увлекла его съ собою къ окну, въ сторону сада и начала съ-оника. Зачѣмъ вы такъ нелюбезны были со мною?Тамъ же.Ср. Когда молодой человѣкъ, отпущенный наконецъ, старымъ камердинеромъ, вошелъ въ залу, его съ-оника встрѣтила Муза.Писемскій. Масоны. 2, 9.Ср. Онъ съ-онику же рѣшился воспользоваться минутнымъ преимуществомъ своего положенія, пока матушка не успѣла еще оправиться и сообразиться.Вс. Крестовскій. Внѣ закона. 2, 4.См. Соника.
С-руки 	Съ-руки (иноск.) кстати.Нашему Луки(ѣ) и чортъ съ-руки.Ср. Мукой напудривъ парики,Бойка на слово, Русь съизмалаПо-европейски лепетала,Брала, что было ей съ-руки...Хватала мудрости вершки.Яхонтовъ. Окно въ Европу.Ср. Моэтъ — вотъ сочинитель славный!Поэтъ доступный, всѣмъ съ-руки...Кн. П. А. Вяземскій. Эперне.См. Рука. См. Верхушек нахвататься.
Сабинянка 	Сабинянка (иноск.) похищенная женщина (намекъ на похищеніе Римлянами Сабинянокъ).Ср. «Новая Сабинянка».(Заглавіе повѣсти Данилевскаго.)Ср. Ее мигомъ въ потьмахъ схватили двѣ крѣпкія руки и стали вязать... Не долго съ нею боролись... Они завязали ей ротъ, стянули вожжею ей ноги и руки, и понесли ее дворомъ къ рощѣ...Данилевскій. Бѣглые въ Новороссіи. Новая Сабинянка. 1, 7.
Сабли на голо! 	Сабли на голо! (команда) — изъ ноженъ вонъ.
Саван 	Саванъ (иноск.) — смерть (намекъ на родъ бѣлой рубахи, иногда надѣваемой на покойника).Ср. Саванъ — снѣгъ (покрывающій застывшую землю).Ср. Этотъ холодный, нагло сверкающій зимній саванъ, налегшій (въ одну ночь) нежданно, негаданно на цвѣтущее лоно весны, представлялся ему дѣйствительно «насиліемъ» какой-то грубой, ненавистной стихійной силы надъ вѣчными, божественными правами ея...Маркевичъ. Лѣсникъ. 6.Ср. σάβανον — толстая ткань (сукно) саванъ.См. Стихийная сила.
Саванны 	Саванны — необработанные лѣса и степи въ Америкѣ.Ср. Savanne (нѣм.), savanna (англ.), savane (фр.) savana (исп.).Ср. Savace (англ.) дикій, необработанный.См. Девственный.
Саваоф 	Саваоѳъ — Богъ сихъ — войскъ (евр. ветхозавѣтное названіе Бога).Ср. Въ ужасъ пришла Аграфена Петровна, услыхавши про радѣнія (хлыстовъ) и прореченія и больше слушать не захотѣла дальше, когда Дуня стала было рассказывать ей о схожденіяхъ самого Господа Саваоѳа на гору Городину, а потомъ на гору Араратскую.Мельниковъ. На горахъ. 4, 1.Ср. Zebaoth (нѣм.), Sabaoth (англ.), Sabaot (итал.)Ср. Sabaot. (Dante. Paradis.)Ср. Deus Sabaoth. (Tertul.)
Савл, Савл, что ты гонишь меня? 	Савлъ, Савлъ, что ты гонишь меня? (иноск. полушутл.) — лицу противодѣйствующему добру, — доброму начинанію (намекъ на слова Спасителя).Ср. Дѣян. Апост. 9, 4.См. Сделаться из Савла Павлом.
