Дитя века 	Дитя (сынъ) вѣка (иноск.) — слѣдующій духу времени.Каковы вѣки, таковы и человѣки.Ср. Я не виноватъ, что я дитя своего времени и не могу раздѣлять въ душѣ моей всѣхъ вашихъ идей....Маркевичъ. Переломъ. 2, 6.Ср. Не вини меня, другъ мой, я сынъ нашихъ дней,Сынъ раздумья, тревогъ и сомнѣній...Надсонъ. „Не вини меня“ (1883).Ср. Вообще онъ былъ врачъ не столько ученый и кабинетный, сколько практическій и.... представлялъ собою истиннаго сына вѣка.Писемскій. Мѣщане. 2, 1.Ср. Я далъ понять выше, что Якубовъ былъ баринъ въ душѣ, природный аристократъ. Между прочимъ онъ былъ сынъ своего вѣка, крѣпостникъ.Гончаровъ. Воспоминанія. 2, 5.См. Аристократия. См. В душе.
Дитя не плачет, мать не разумеет 	Дитя не плачетъ, мать не разумѣетъ.Ср. Ты попробуй (просить денегъ) — безъ просьбы нельзя же: дитя не плачетъ, мать не разумѣетъ... Ну-ка попробуй...Мельниковъ. Въ лѣсахъ. 3, 10. Потапъ Максимычъ.Ср. Artiges Kind frägt nichts, artiges Kind kriegt nichts.Ср. Не даютъ груди грудному младенцу, который не плачетъ. (Турецк. посл.)Ср. Тотъ, который говоритъ (проситъ), не остается голоднымъ. (Турецк. посл.)Ср. Decourdemanche. Prov. Turcs.См. Просите и дастся вам, ищите и обрящете, толцыте и отверзется вам.
Дифирамб 	Диѳирамбъ (иноск.) неумѣренная, восторженная хвала.Ср. Одна маленькая похвала женщинъ для меня дороже цѣлаго дифирамба со стороны мужчины......Горькій. Однажды осенью...Ср. Ничего не можетъ быть глупѣе, какъ положеніе человѣка, которому, заслуженно или незаслуженно, воздаютъ хвалу въ глаза. Одинъ изъ вашихъ петербургскихъ львовъ ... насказалъ мнѣ такихъ любезностей, что я не зналъ куда дѣться. Я нечаянно взглянулъ въ эту минуту въ зеркало и былъ до того пораженъ совершенно идіотскимъ выраженіемъ моей физіономіи, что, не дослушавъ диѳирамба, убѣжалъ отъ него стремглавъ, будто пойманный въ преступленьи.Маркевичъ. Четверть вѣка назадъ. 2, 1.Ср. Διθύραμβος (δις — θύρα — ἀμφιβαίνω) празднованіе всяческое — прозваніе Вакха (и гимна въ честь его — вылившагося подъ вліяніемъ Вакха и его даровъ).
Диффамация 	Диффамація (юрид.) клеветническое опозориваніе.Диффаматоръ, клеветникъ, поноситель.Ср. У насъ клевета и диффамація самый ходкій товаръ и на всякое чиханіе не наздравствуешься.Боборыкинъ. Василій Теркинъ. 1, 28.Ср. Скверное это ремесло (диффаматоровъ) и по существу, и по послѣдствіямъ, но, несмотря ни на что, ряды диффаматоровъ не только не рѣдѣютъ, но день ото дня становятся плотнѣе и плотнѣе. Стало быть, таково уже знаменіе времени.Салтыковъ. Мелочи жизни. Читатель. 3.Ср. Diffamare (dis, разъ — fama, слава) разславлять (въ худомъ смыслѣ).См. На всякое чихание не наздравствуешься. См. Знамение времени.
Дичь пороть 	Дичь пороть — нести (иноск.) — дикія мысли — чужь.Ср. Чичиковъ совершенно спутался и потерялся, чуть не плюнулъ самъ и мысленно сказалъ: «Господи, что за вздоръ несу!..»Гоголь. Мертвыя души. 2, 2.Ср. Безъ заминки, гдѣ придется,Всюду поретъ дичьИ поэтому зоветсяМилый Петръ Ильичъ!В. С. Курочкинъ. Общій знакомый.Ср. Такую дичь несетъ,Что уши вянутъ.Крыловъ. Мѣшокъ.Ср. Израильтянамъ вмѣсто хлѣбаСперва слетала манна съ неба,А послѣ дичь!А намъ въ театрѣ, въ пьесахъ МаннаУвы! ужъ не спадала манна,А просто — дичь ...П. А. Каратыгинъ (о нѣкоторыхъ пьесахъ Манна). Ср. Исходъ. 16, 4, 16.Ср. Ежели столбнякъ и попройдетъ, то занесетъ такую дичь, что у Бога просишь опять столбняка.Фонвизинъ. Недоросль. 2, 5. Простакова.См. Молоть. См. Чепуху городить, нести, молоть.
Длинный 	Длинный (иноск.) о чрезмѣрной растянутости (разсказа).Длиннота растянутость.Ср. Какое хочешь имя дайТвоей поэмѣ полудикой;Петръ длинный, Петръ Большой, но только Петръ ВеликійЕе не называй.К. Н. Батюшковъ. Совѣтъ эпическому стихотворцу.Ср. Романъ классическій, старинный,Отмѣнно длинный, длинный, длинный,Нравоучительный и чинный.А. С. Пушкинъ. Гр. Нулинъ.Ср. Сначала краткости, теперь ужъ тыБоишься длинноты.Я самъ того-жъ боюсь.Крыловъ. Плотичка.Ср. C’est bien, mais il y a des longueurs dans ce distique (хорошо, но есть длинноты).Rivarol (по поводу просьбы сказать свое мнѣніе объ одномъ двустишіи Кн. Бор. Влад. Голицына).См. Великий.
Длинный язык 	Длинный языкъ (иноск.) о болтливомъ.Волосъ дологъ, а языкъ длинный (у бабы).Ср. «У него языкъ дологъ» (народн.) о дерзкомъ и лишнее говорящемъ.
Для блезира 	Для блезира сдѣлать что (иноск.) ради шутки, забавы, развлеченія.Ср. Вообще она стала хозяйкой не для блезиру, а взялась за дѣло плотно, безъ шума, безъ треска, но... солидно.Лѣсковъ. Въ провинціи. 21.Ср. Plaisir — удовольствіе.См. В сериоз. См. Солидничать.
Для вящшей славы Божией 	Для вящшей славы Божіей.Ср. So lange es noch Fanatiker in der Welt geben wird, ist kein Bubenstück so grässlich, dass nicht irgend ein betrogener Wahnsinniger in majorem Dei gloriam zu verüben im Stande sein sollte.Wieland. Vermischte Schriften.Ср. Ad majorem Dei gloriam.Поясн. Девизъ Іезуитскаго ордена (основ. 1540 г.) встрѣчается часто въ канонахъ и постановленіяхъ Тридентскаго собора (1562).Ср. Canones et decreta concilii Tridentini.Ср. A. M. D. G. Эпиграфъ на журналѣ «Apocalypse». 1791.Поясн. Эти иниціалы были напечатаны на ручкѣ плети, которой драли въ іезуитскихъ училищахъ — ad maiorem Dei gloriam.
Для камердинера нет героя 	Для камердинера нѣтъ героя.Ср. Для лакея не можетъ быть великаго человѣка, потому что у лакея свое понятіе о величіи.Гр. Л. Н. Толстой. Война и Миръ. 4, 4, 5.Ср. Говорятъ, для камердинера не бываетъ героя, но всѣ современники суть камердинеры.Фельдмаршалъ Князь Паскевичъ.Ср. Für einen Kammerdiener giebt es keine Helden.Ср. Dass ein Fürst vor seinem Kammerdiener viel verliert, kommt daher, weil kein Mensch gross ist.Kant. Nachlass.Ср. Es giebt, sagt man, für den Kammerdiener keinen Helden.
Das kommt aber bloss daher, weil der Held nur von Helden anerkannt werden kann.Goethe. Wahlverw. 2, 5.Ср. Hegel. Phänomenologie des Geistes. 1807.Ср. Il n’y a pas de héros pour son valet de chambre.M-me Cornuel (Ср. Lettres de M-lle Aïssé. 1846).Ср. Plus on approche des grands hommes, plus on trouve qu’ils sont hommes. Rarement ils sont grands vis-à-vis de leurs valets de chambre.La Bruyère. Caract.Ср. La plupart des héros sont comme de certains tableaux, pour les estimer il ne faut pas les regarder de trop près.La Rochefoucauld.Ср. Pour son siècle incrédule un héros n’est qu’un homme.Lamartine.Ср. Il faut être bien héros, pour l’être aux yeux de son valet de chambre.Le maréchal de Catinat († 1712).Ср. Peu d’hommes ont été admirés par leurs domestiques.Montaigne. Essais. 3, 2.Поясн. Нѣкоторые приписываютъ это слово Г-жѣ Корнюэль (Précieuse du XVII s.).Поясн. Антигонъ I. Гонатъ, царь Македонскій († 240 до Р. Х.), отвѣтилъ Гермодоту, который въ стихахъ назвалъ его сыномъ солнца и Бога: Объ этомъ мой камердинеръ ничего не знаетъ.Ср. Plutarch. Isis et Osiris. 24; Apophtegm. reg. et imp.Ср. Никто не можетъ быть великимъ человѣкомъ для своего доктора.Принцъ Александръ Нидерландскій.
Для контенанса 	Для контенанса (для смѣлости, для твердости духа).Ср. На основаніи свѣтскихъ правилъ, ею изобрѣтенныхъ... свѣтская дама, гдѣ бы она ни сидѣла: въ гостиной, у себя дома или у чужихъ, непремѣнно должна для контенансу держать въ правой рукѣ лорнетку, вѣеръ или шитый платокъ.Григоровичъ. Два генерала. 15.Ср. Аѳанасій Лукичъ, хотя отъ роду не пивалъ водки, но тутъ «для контенансу», выпивъ рюмочку, хотѣлъ, было, по крайней мѣрѣ крякнуть съ нѣкоторою самостоятельностью и не произвелъ ни малѣйшаго звука.Тургеневъ. Три портрета.Ср. Contenance — осанка, видъ.Ср. Continere (con — tenere) — держать, сдерживать, обуздывать.
Для красного словца — Не пощадит ни матери, ни отца 	Для краснаго словца —Не пощадитъ ни матери, ни отца.
Для милого дружка и сережку из ушка 	Для милаго дружка и сережку изъ ушка иноск. — все сдѣлать (любимое украшеніе готовъ отдать).Ср. Помилуйте, радъ всей душой; для милаго дружка и сережка изъ ушка...Григоровичъ. Проселочныя дороги. 1, 9.Ср. Мужъ моей сестры... отсчиталъ двѣ тысячи и сказалъ: для милаго дружка и сережка изъ ушка.Салтыковъ. Мелочи жизни. Въ сферѣ сѣянія. 2.Ср. Ладно, ладно! для дружкаИ сережку изъ ушка!
Для очистки совести 	Для очистки (успокоенія) совѣсти.Ср. И онъ бы такъ сдѣлалъ. И потому, если ругался... то безъ всякой злобы, а только такъ, для очистки совѣсти.Достоевскій. Записки изъ Мертв. дома. 1, 1.Ср. Я ничего не вымогаю у васъ, Елена Александровна, замѣтьте, вы сами предлагаете, какъ бы для очистки совѣсти, вымолвилъ онъ съ веселою улыбкой.Б. М. Маркевичъ. Бездна. 2, 8.Ср. Par acquit de conscience.Ср. Quietus — спокойный.Ср. Все, что̀ продается на торгу, ѣшьте безъ всякаго изслѣдованія, для спокойной совѣсти.1 Коринѳ. 10; 25, 27.
Для первого дебюта 	Для перваго дебюта (иноск. шутл.) для перваго начала, съ перваго раза, на первыхъ порахъ (намекъ на первый дебютъ — выходъ, участіе въ представленіи артиста).Ср. (Я) даже очень умный-съ. Вотъ, во-первыхъ, я ѣмъ съ барскаго стола... во-вторыхъ, сошелся съ ключницей и занялъ у нея денегъ; да еще у меня бутылка наливки въ уголку подлѣ кровати, будто вакса... «Для перваго дебюта не дурно».Островскій. Лѣсъ. 4, 1.Ср. Début (de-but, de bout — съ начала) первый шагъ, выходъ, выѣздъ (опытъ) — начало.Ср. Débuter начинать (рѣшаться, мѣтить на что).Ср. Débutant дебютантъ — начинающій поприще.Ср. But — цѣль, намѣреніе.
Для проформы 	Для проформы (иноск.) ради соблюденія формальности, а не ради дѣла.Ср. Все это давно уже выучено, тысячу разъ пѣто, пережевано и поется только для проформы. Поется лѣниво, машинально.А. П. Чеховъ. Пѣвчіе.Ср. Pro forma — ради формальности.См. Пета бяху — стара песня!. См. Пережевать. См. Машинально.
Для пьяного и со свечею худо; Да вряд, не хуже-ль и в потьмах 	Для пьянаго и со свѣчею худо;Да врядъ, не хуже-ль и въ потьмахъ.
Днем со свечей(огнем, фонарем) не отыскать 	Днемъ со свѣчей (огнемъ, фонаремъ) не отыскать.Ср. Твоего добра и днемъНе сыскать со свѣчкою
Днесь и присно и на веки 	Днесь и присно и на вѣки (всегда).Ср. Благослови ГосподьТебя и днесь и присно и на вѣки.А. С. Пушкинъ. Борисъ Годуновъ. Пименъ Григорію.
Дни его уж были сочтены 	Дни его ужъ были сочтены (иноск.) близокъ къ смерти.Ср. Дни его ужъ были сочтены.Жуковскій. Капитанъ Боппъ.Ср. Сладкой жизни мнѣ немногоПровожать осталось дней;Парка счетъ ведетъ имъ строго,Тартаръ тѣни ждетъ моей.А. С. Пушкинъ. Ода. 5, 6. (изъ Анакреона.)См. Плутон. См. Тартар. См. Парка.
Душа в пятки ушла 	Душа въ пятки ушла (отъ страха).Ср. Ну, говорю имъ, не трусить!... А у нихъ ужъ душа въ пятки ушла! такъ и трясутся!Достоевскій. Записки изъ Мертваго дома. 1, 8.Ср. И теперь уйдешь весь въ пятки,Какъ посредникъ налетитъ.Некрасовъ. Ночлеги. 3.Ср. А вотъ я-то войду, какъ потерянный, —И ударится въ пятки душа.Некрасовъ. Застѣнчивость.Ср. Вотъ въ знакомый вбѣжалъ магазинъ,Вытеръ потъ на лицѣ, нѣтъ лица на купцѣ:Душу въ пятки упряталъ Смирдинъ.К. П. Бахтуринъ. Баронъ Брамбеусъ.Ср. Das Herz ist ihm in die Hosen gefallen.Ср. Remettre le coeur au ventre à quelqu’un.Пер. (Возвратить смѣлость.)Ср. Animus in pedes decidit.Пер. Душа въ ноги ушла.Erasmus. Adag. 1, 8, 70.Ср. πᾶσιν δὲ παραὶ ποσὶ κάππεσε θυμός.Пер. У всѣхъ душа въ ноги упала.Hom. Ilias. 15, 280 (ужасъ при видѣ Гектора).
Душа дела 	Душа дѣла (иноск.) главный дѣятель, двигатель.Ср. Душою страстною и неустанною всего дѣла (судебной реформы) сталъ Зарудный.А. Ф. Кони. Памяти С. И. Заруднаго (въ Собраніи юрид. Общества. 1899 г.).См. Душа общества.
Душа из тела рвется вон 	Душа изъ тѣла рвется вонъ.Ср. Весь міръ, какъ смрадная могила!Душа изъ тѣла рвется вонъ...Вонми смиренію души ...И духъ отъ тѣла разрѣши.К. Ѳ. Рылѣевъ. 1826. „Мнѣ тошно здѣсь“.Ср. Такъ и рвется душаИзъ груди
Душа коротка 	Душа коротка (иноск.) о человѣкѣ безстрастномъ — со слабой, несильной душой.Ср. «У нѣмца ножки тоненьки, душа коротенька».Ср. Ты не можешь такъ влюбиться, какъ я... оттого, что у тебя душа коротка, благородныхъ чувствъ мало... Во мнѣ искра есть, а въ тебѣ нѣтъ. Я лихой малый, душа на распашку.Островскій. На бойкомъ мѣстѣ. 1, 7.См. На распашку.
Душа меру знает 	Душа мѣру знаетъ (ѣшь и пей, сколько хочется).Ср. Мы находимъ и въ самомъ низшемъ слоѣ общества чудаковъ, и потому едва ли не должны признать чудачество врожденнымъ свойствомъ человѣка, выраженіемъ свободной воли и независимости, дошедшимъ до нѣкоторой крайности. Видно душа не всегда мѣру знаетъ.Даль. Картины русскаго быта. 9. Чудачество.Ср. Лучше я съѣмъ двухъ блюдъ, да съѣмъ въ мѣру, какъ душа требуетъ. Собакевичъ подтвердилъ это дѣломъ: онъ опрокинулъ половину бараньяго бока къ себѣ въ тарелку, съѣлъ все....Гоголь. Мертвыя души. 1, 5.См. Пей из ковша, а мера душа.
Душа не на месте 	Душа не на мѣстѣ (иноск.) безпокоиться.Ср. Здѣсь у меня душа не на мѣстѣ. Ну, сохрани Богъ, украдутъ что-нибудь у насъ — пропалъ я.Тургеневъ. Безденежье. Матвѣй.
Душа общества 	Душа общества (иноск.) главный собесѣдникъ, по умѣнію занять общество и оживлять его.Ср. Нѣкто С... душа общества, напившись предводительскаго вина, подалъ мысль собрать «музей бетизовъ» Всеволожскаго....Лѣсковъ. Разсказы кстати. 3, 4.Ср. Славный такой малый... не бѣдный былъ и веселый такой, душа общества мы всѣ его звали.Б. М. Маркевичъ. Бездна. 2, 18.См. Душа дела.
Душа пузыри пускает 	Душа пузыри пускаетъ (иноск. народн.) — икается.
Душа с Богом беседует 	Душа съ Богомъ бесѣдуетъ (иноск. народн. шутл.) — объ отрыжкѣ.
Душа(грудь, человек) на распашку 	Душа (грудь, человѣкъ) на распашку (иноск.) — откровенный, прямой.Душа (ротъ) на распашку, языкъ на плечо!Ср. Познакомьтесь и подружитесь съ нимъ: прекрасный человѣкъ — душа на распашку.Гончаровъ. Обыкновенная исторія. 1, 2. Письмо Василія Заѣзжалова.См. На распашку.
Душа(душою) в душу 	Душа (ою) въ душу (жить съ кѣмъ-нибудь) — дружно, согласно, любовно.Ср. Мы тотчасъ поладили... Мы жили душа въ душу. Другого ментора я и не желалъ...А. С. Пушкинъ. Капитанская дочка. 1.Ср. Жилъ съ нимъ вмѣстѣ, что называется, душа въ душу.Гончаровъ. На родинѣ.Ср. Сосѣдъ тамъ — такъ настоящій сосѣдъ, живутъ рука въ руку, душа въ душу.Гончаровъ. Обыкновенная исторія.Ср. Душою въ душу жилъ онъ съ ней.Баратынскій. Переселеніе душъ.См. Ментор.
Душа-человек 	Душа-человѣкъ (иноск.) добродушный, прямой, сердечный.Ср. Онъ милый малый, душа-человѣкъ, онъ такъ сердечно снисходитъ къ человѣческимъ слабостямъ; онъ сговорчивъ, податливъ, покладистъ, не гордъ, съ нимъ и выпить можно, и посквернословить, и посудачить....Ант. Чеховъ. Дуэль. 4.Ср. Вотъ душа-человѣкъ! Нужды нѣтъ, что изъ боярскихъ дѣтей, а много проще нашего брата будетъ.Островскій. Мининъ. 1, 2.Ср. Тотъ же все, братъ, теплый человѣкъ, душа-человѣкъ, какъ былъ...Маркевичъ. Бездна. 3, 13.Ср. И родитель былъ душа-человѣкъ, а этотъ и того лучше; всякому доступенъ, всякаго по силѣ возможности милуетъ....П. И. Мельниковъ. Непремѣнный. Ср. Въ лѣсахъ. 2, 11.Ср. (Онъ) былъ душа-человѣкъ: радушный, ласковый, доброжелательный, хлѣбосольный....Мельниковъ. На горахъ. 1, 8.См. Рубаха-парень. См. Сквернословие. См. Наш брат.
Душегубка 	Душегубка (иноск. шутл.) желѣзная дорога.Ср. Душегубка, лодочка-долбушка, однодеревка.Ср. Печать? У ней строитель — воръ!Желѣзныя дороги — душегубки!...Некрасовъ. Современники. Герои дня. 10-ый голосъ.
