...A voli troppo alti e repentini… 	См. Счастью не вовсе верь!.
...Due cose belle ha il mondo:… 	См. Смерть к светлой вечности нам отворяет дверь.
...Monarca, a cui… 	См. Солнце не заходит в моем государстве.
A ami racommodé ne te fie qu’à moitié. 	См. Замиреный друг не надежен.
À aucuns les biens viennent en dormant. 	См. Счастье и сонного найдет.
A blind man would bi glad to see it. 	См. Посмотрим, сказал слепой, как будет плясать хромой.
A bon chat — bon rat. 	См. Дока.
A bon vin il ne faut point d’enseigne. 	См. Хороший товар сам себя хвалит.
A bonne volonté ne faut la faculté. 	A bonne volonté ne faut (ne manque pas) la faculté.См. Хочу — половина могу.
A bow long lent at length must wax wease. 	См. Что больше понатягивать, то скорее лопнет.
A bras ouverts. 	См. С распростертыми объятиями.
A Brebis tondu Dieu mesure le vent. 	См. Бог по силе крест налагает.
A buon intenditor poche parole bastano. 	См. Умный слышит в полслова.
A buon vino non bisogna frasca. 	См. Хороший товар сам себя хвалит.
A burnt child dreads the fire. 	См. Обжегшись на молоке, будешь дуть и на воду.
A cader va chi troppo in alto sale. 	См. Гроза бьет по высокому дереву.
A caliga ad consulatum perductus. 	A caliga ad consulatum perductus (Marius).См. Худой солдат, который не надеется быть генералом.
A capillis usque ad ungues. 	См. От головы до пяток.
A capite usque ad calcem. 	См. От головы до пяток.
A caval donato non si guarda in bocca. 	См. Даровому коню в зубы не смотрят.
A chair de loup dent de chien. 	См. На крепкий сук — острый топор.A chair de loup dent de chien.См. Нашла коса на камень.
A chaque saint sa chandelle. 	См. Молчалин.
A chemin battu il ne croît point d’herbe. 	См. На битой дороге трава не растет.
A cheval donné il ne faut point regarder dans la bouche. 	См. Даровому коню в зубы не смотрят.
A chose faite point de remède. 	См. Что о том тужить, чего нельзя воротить.
A corsaire corsaire et demi. 	См. Плут плутом губится.
A cœur vaillant rien d’impossible. 	См. Смелым Бог владает.
A demain les affaires. 	См. Завтра, завтра, не сегодня, Так ленивцы говорят.
A desonor meurt à bon droit… 	См. Книги — лучший друг человека.
A dix il faut faire une croix. 	См. Крест поставить.
À fou — fortune. 	См. Дуракам счастье.
A fronte simul et occipitio oculatus. 	См. На затылке глаз нет.
A furore Normanorum libera nos domine! 	См. Фурия воинственная.
A good neighbour, a good morrow. 	См. Не купи двора, купи соседа.
A habitation giddy and unsure… 	См. Любовь народная.
A horse! a horse! my kingdom for a horse. 	См. Коня! коня! Престол мой за коня.
A la chandelle la chèvre semble demoiselle. 	См. Ночь матка — все гладко!.
A la guerre comme à la guerre. 	См. На войне, как на войне.
A la lettre. 	См. Слово в слово.
A la plume et au chant l’oiseau, et au parler le bon cerveau. 	См. Знать человека — по речам.
Aliquando et insanire iucundum est. 	См. Делу время, потехе час.
Aliquem foras quatere. 	См. Расквасить нос.
Aliquem lactare, et falsa spe producere. 	См. По губам мазать.
Aliquid ad parietem figere. 	См. Афишевать.
Aliquid mali propter vicinum malum. 	См. Не купи двора, купи соседа.
Aliquis in omnibus, nullus in singulis. 	См. Мы все учились понемногу, Чему-нибудь и как-нибудь.
Aliud ex alio malum. 	См. Беда беду родит.
Aliud stans, aliud sedens sentis. 	Aliud stans, aliud sedens (de patria) sentis.См. Семь пятниц на неделе.
Alium silere quod voles, primus sile. 	См. За собой слово не удержав, за людьми не удерживают.Alium silere quod voles, primus sile.См. Скажешь с уха на ухо, узнают с угла на угол.
Alius alio plus invenire potest, nemo omnia. 	См. Всезнанья Бог человеку не дал.
All by love and nothing by force. 	См. Не все таской, ино и лаской.
All covet, all lose. 	См. За все браться — ничего не сделать.
All is but toys. 	См. Все суета.
All is weil, that end’s well. 	См. Конец венчает дело.
All ogni uccello suo nido è bello. 	См. Всякому свое мило.
All that glisters is not gold. 	См. Не все то золото, что блестит.
All the world’s a stage… 	См. Сойти со сцены.
All things that are… 	См. Наслажденье изменяет.
All zu straff gespannt, zerspringt der Bogen. 	См. Что больше понатягивать, то скорее лопнет.
Alla gloria non si va senza fatica. 	См. Крепость и волю дарует борьба.
Alle Cultur geht vom Magen aus. 	См. Брюхо.
Alle Hände voll zu thun haben. 	См. Хлопот — полон рот.
Alle Jubeljahr einmal. 	См. Юбилей.
Alle über einen Leisten geschlagen. 	См. На один копыл чорт всех ляхов покроил.
Aller Anfang ist schwer, am schwersten der Anfang in der Wirtschaft. 	См. Лиха беда начало!.
Aller guten Dinge sind drei. 	См. Бог любит троицу.
Aller où le Roi va à pied  ... 	Aller où le Roi va à pied (n’envoie personne) ...См. Надобность царя Саула.
Aller par quatre chemins… 	См. На все четыре стороны.
Aller planter ses choux. 	См. Цинцинат.
Aller sur la hacquenée des cordeliers. 	См. По способу пешего хождения.
Aller sur la mule des cordeliers. 	См. По способу пешего хождения.
Alles Ding hat zwei Seiten. 	См. Изнанка медали.
Alles durch den Schornstein jagen. 	Alles durch den Schornstein jagen (verprassen).См. Пустить в трубу.
Alles Gescheite ist schon gedacht worden, man muss nur versuchen es noch einmal zu denken. 	См. Все уже было сказано.
Alles Gute kommt von oben. 	См. Всякое даяние благо.
Alles in der Welt lässt sich ertragen… 	См. Под ним струя светлей лазури, Над ним луч солнца золотой; А он, мятежный, просит бури, Как будто в бурях есть покой!.
Alles mit Mass, sagte der Bauer, und trank ein Mass nach dem anderen. 	См. Сам себе знай меру.
Alles schon dagewesen. 	См. Ничто не ново под луною.
Alles, was ist, ist vernünftig. 	См. Все, что существует, разумно.
Alles, was man Wohlanständigkeit nennt, ist nichts als schöner Schein. 	См. Что не воспрещается — дозволяется.
Asino lyra superflue canit. 	См. Смыслен, как осел к волынке.
Asinos non curo. 	См. Собака лает, ветер носит.
Asinus ad Lyram. 	См. Избави, Бог, и нас от этаких судей.Asinus ad Lyram.См. Смыслен, как осел к волынке.
Asinus ad Lyrum. 	См. Свинья в апельсинах.
Asinus asinum fricat. 	См. Дурак дурака хвалит.
Asinus auricula movens. 	См. Хлопать ушами.
Asinus inter simias. 	См. Мистификация.
Asperius nihil est humili, cum surgit in altum. 	См. Натореет крестьянская овца, лучше боярской козы обрыкается.
Assai guadagne chi vano sperar perde. 	См. Век живи, век надейся.
Assassins juridiques. 	См. Судебная ошибка.
Assez ottroie qui ne dit. 	См. Молчание знак согласия.
Assidua stilla saxum excavat. 	См. Капля по капле и камень долбит.
Assomer un garde-chempétre, ce n’est pas assomer un homme! C’est écraser un principe! 	См. Принцип.
At enim nihil est, nisi, dum calet, hoc agitur... 	См. Куй железо, пока горячо.
At every word a reputation dies. 	См. Что слово — приговор.
At pulchrum est digito monstrari et dicier: hic est! 	См. Пальцем показывать.
Athenas intrasse et Solonem non vidisse! 	См. Быть в Риме — и не видать Папы.
Atque maritorum capita cornua non desunt. 	См. Рога приставить.
Atrocitati mansuetudo est remedium. 	См. Покорное слово — гнев укрощает.
Attenuant vigiles corpus miserabile curae. 	См. Не годы старят — а горе.
Attingit ergo a fine usque ad finem fortiter et disponit omnia suaviter. 	См. Железная рука, но мягкая перчатка.Attingit ergo a fine usque ad finem fortiter et disponit omnia suaviter.См. Твердо в деле, мягко в формах.
Au banquet de la vie infortuné convive… 	См. Жизненный пир.
Au besoin voit-on son ami. 	См. Друг познается в несчастии.
Au bon chouleur la pelote lui vient. 	См. Шулер.
Au bon vieux temps. 	См. Доброе старое время.
Au bord des fleuves de Babylone. 	См. При реках Вавилона — там сидели мы и плакали, когда вспоминали о Сионе.
Au cas que Lucas n’ait qu’un œil, sa femme épousera un borgne. 	См. Кабы не кабы, так и мы-б были цари.
Au dégouté le miel est amer. 	См. Сыта корова, коли макухи не ест.
Au demeurant le meilleur fils du monde. 	См. Хороший бы человек, да никуда не годится.
Au dessous est qui prie. 	См. Поклонишься и кошке в ножки!.
Au mort et à l’absent… 	См. Покойника не поминай лихом.
Au Muséum d’histoire naturelle à Paris, le masque de Cartouche se trouve placé entre ceux de Voltair… 	Au Muséum d’histoire naturelle à Paris, le masque de Cartouche se trouve placé entre ceux de Voltaire et de J. J. Rousseau: Habent sua fata libelli.См. Равны читатели, — Над книгой их права равны.
Au nom de qqchose. 	См. Во имя.
Au pied de l’échafaud il essaie encore la lyre. 	См. Лира.
Au pied levé. 	См. На одной ноге стоя.
Au prêter Dieu, au rendre diable. 	См. Хочешь врага нажить — дай ему взаймы.
Au rire on connait le fol. 	См. Нет ничего глупее глупого смеха.
Au temps que les bêtes parlaient. 	Au temps que les bêtes parlaient (ce qui paraît souvent se faire et à présent).См. Во время оно.
Au vray dire pert-on le jeu. 	См. Правду говорить, никому не угодить.
Auch Bücher haben ihr Erlebtes. 	См. Равны читатели, — Над книгой их права равны.
Blöde Jugendeselei. 	См. Фалалей в избе не нашел дверей.
Blöder Hund wird selten satt. 	См. Стыдливый из-за стола голодный встает.
Blödes Herz buhlt keine schöne Frau. 	См. Фалалей в избе не нашел дверей.
Bluestocking. 	См. Синий чулок.
Blut ist ein ganz besondrer Saft... 	См. Кровь не вода.
Bluthund. 	См. Кровопийца.
Blutige Thränen weinen. 	См. Кровавые слезы.
Bohème. 	Bohème (c’est une maison — vie de Bohème).См. Богема.
Boire comme un templier. 	См. Пьет, как в бездонную кадку льет.
Boire et manger, coucher ensemble… 	См. Брак холодит душу.
Boire le vin du marché. 	См. Вспрыснуть.
Bon battre sa femme en hui. 	См. Жену бей, так и щи вкусней.
Bon gré mal gré. 	См. Волею, неволею.
Bon mot n’espargne nului. 	См. Для красного словца — Не пощадит ни матери, ни отца.
Bon vivant. 	См. Бонвиван.
Bona opinio homini tutior pecunia est. 	См. Добрая слава лучше богатства.
Bona pro stercore habet. 	См. Куры не клюют.
Boni judicis est ampliare jurisdictionem. 	Boni judicis est ampliare jurisdictionem. (jur.)…См. Разум закона.
Boni pastoris est tondere pecus, non deglubere. 	См. Доброго пастыря дело овец стричь, а кожи не снимать.
Bonis honesta fert exitium veritas. 	См. Правду говорить — себе досадить.
Bonis nocet, quisquis pepercerit malis. 	См. Кто злым попускает, тот сам зло творит.
Bonis quod bene fit, haud perit. 	См. Кто добро творит, тому Бог отплатит.
Bonne renommée vaut mieux que ceinture dorée. 	См. Добрая слава лучше богатства.
Bonos corrumpunt mores congressus mali. 	См. Беседы злые — тлят обычаи благие.
Bons marchies traict argent de borse. 	См. Дешево да гнило, Дорого да мило.
Bont est une… 	См. Девка хороша, да слава не хороша.
Bonus judex secundum aequum et bonum judicat, et aequitatem stricto juri praefert. 	Bonus judex secundum aequum et bonum judicat, et aequitatem stricto juri praefert. (jur.)…См. Разум закона.
Böse Waare muss man aufschwatzen. 	См. Не солгать, так не продать.
Böse Zunge, ein bös Gewehr. 	См. Злые языки — острый меч.
Böse Zungen schneiden schärfer denn Schwerter. 	См. Злые языки — острый меч.
Böses muss mit Bösem enden. 	См. Лихому лихое.
Bottom upwards. 	См. Вверх дном.
Bouche de miel, coeur de fiel. 	См. На словах медок, а на сердце ледок.
Bouchet. Panégyrique du Chevalier sans reproche, messire Louys de la Trimouille. Poitiers. 1527. 	Bouchet. Panégyrique du Chevalier sans reproche, messire Louys de la Trimouille. († 1525 à Pavia.) Poitiers. 1527.См. Рыцарь без страха и упрека.
Bramarbasiren. 	См. Фордыбачить.
Braun und blau schlagen. 	См. Помять бока.
Brave comme saint George. 	См. Георгиевский кавалер.
Bread is the staff of life. 	См. Хлеб насущный.
Brebis comptées le loup les mange. 	См. Волк и из счету овец крадет.
Brechen Sie dieses geheimnissvolle Schweigen. 	См. Сломить молчания печать.
Chi ama il padrone fa carezze al cano. 	См. Любишь меня, люби и собаку мою.
Chi contro Dio gitta pietra, in capo gli torna. 	См. Выше носу плюнешь — себя заплюнешь.
Chi digiuna e altro ben non fa, a casa del diavol se ne va. 	См. Не сквернит в уста, а сквернит из уст.
Chi due lepri caccia… 	См. За двумя зайцами погонишься — и одного не поймаешь.
Chi è largo di bocca è stettodi mano. 	См. На словах, как на гуслях, а на деле — как на балалайке.
Chi fa il conto senza l’oste, lo fa duo volte. 	См. Рассчитать без хозяина.
Chi ha fortuna in amor, non giuochi a carte. 	См. Несчастлив в игре, так счастлив в любви.
Chi ha mal vicin ha mal mattin. 	См. Не купи двора, купи соседа.
Chi la pace non vuol, la guerra s’abbia. 	См. Если хочешь мира, готовься к войне.
Chi lingua ha, Roma va. 	См. Язык до Киева доведет.
Chi non ama le donne, il vino, il canto… 	См. Блажен, кому с друзьями Свою весну пропировать дано, Кто видит мир туманными глазами И любит жизнь за песню и вино.
Chi non ha, non è. 	См. Без денег и разума нет.
Chi non istima il sol quatt’rino… 	См. Кто не бережет копейки, сам рубля не стоит.
Chi non risica, non rosica. 	См. Риск — благородное дело.
Chi non sà orare, vada in mare. 	См. Кто на море не бывал, тот до сыта Богу не маливался.
Chi parla semina, chi tace raccoglie. 	См. Слово серебро, молчание — золото.
Chi più intende, più perdona. 	Chi più intende, più perdona (prov.).См. Мы почти всегда извиняем то, что понимаем.
Chi può dir com’ egli arde, è in picciol. 	См. Я любви не числю и не мерю.
Chi può vantarsi… 	См. Кто перед Богом не грешен, перед Царем не виноват.
Chi raro viene, vien bene. 	См. Где любят, тут не часто гости.
Chi semina vento raccoglie tempestà. 	См. Сеящие ветер, пожнут бурю.
Chi si ajuta Iddio l’ajuta. 	См. На Бога надейся, а сам не плошай.
Chi si loda, s’imbroda. 	См. Ржаная каша сама себя хвалить.
Chi sputa in su, lo sputo gli torna sul viso. 	См. Выше носу плюнешь — себя заплюнешь.
Chi trova un amico, trova un tesoro. 	См. Друг — денег дороже.
Chi va piano, va sano, chi va sano, va lontano. 	См. Тише едешь, дальше будешь.
Chi vede il periglio… 	См. На укоризну мы Фортуне тороваты.
Chiamare la gatta — gatta. 	См. Называть вещи своим именем.
Chien qui aboie ne mord pas. 	См. Не бойся собаки, которая лает.
Chiromancie. 	Chiromancie (ki).См. Хиромантия.
Choose an author as you choose a friend. 	См. Книги — лучший друг человека.
Chorea Machebaeorum. 	Chorea Machebaeorum (Macabre — Machabée).См. Пляска смерти.
Chose donnée doit estre louée. 	См. Даровому коню в зубы не смотрят.
Chose non connue n’est haïe ne désirée. 	См. Чего не знаю, по тому не скучаю.
Chose promise, chose due. 	См. Не дав слова, крепись, а дав слово, держись.
Chronique scandaleuse. 	См. Скандальная хроника.
Ci gît mon ami Mardoche… 	См. Что не складно, то и не ладно.
Ci-gît ma femme: oh qu’elle est bien… 	См. Добрая жена — веселье, а худая — зло зелье.
Ciabattiere, — Parla sol del tuo mestiere. 	См. Не свыше сапога.
Cibi condimentum fames est! 	См. Голод лучший повар.
C’est à prendre ou à laisser. 	См. Любо бери, не любо, прочь поди.
C’est à savoir. 	C’est à savoir (s’il osera).См. Это еще вопрос!.
C’est à tort qu’on dit: Fronti nulla fides; l’erreur naît d’une imparfaite et superficielle étude. 	См. На лбу написано.
C’est ainsi qu’en partant je vous fais mes adieux. 	См. Я в пустыню удаляюсь От прекрасных здешних мест.
C’est beaucoup tirer de notre ami, si, étant monté en faveur, il est encore un homme de notre connai… 	C’est beaucoup tirer de notre ami, si, étant monté en faveur, il est encore un homme de notre connaissance.См. Честь переменяет нравы.
C’est chose illustre et très louable… 	См. Что о том тужить, чего нельзя воротить.
C’est chose qui moult desplaist… 	См. Не петь курице петухом, не владеть бабе мужиком.
C’est dans l’ordre des choses. 	См. В порядке вещей.
C’est de la fatalité. 	C’est de la fatalité (Belle Helène).См. Фатальный.
C’est du haut allemand. 	См. Китайская грамота.
C’est du latin de cuisine, il n’y a que les marmitons qui l’entendent. 	См. Кухонная латынь.
C’est elle! Dieu que je suis aise! 	См. Библиоман.
C’est en amour surtout que les absents ont tort. 	См. С глаз долой из памяти вон.
C’est encore l’opinion du petit peuple dans la Périgord, qu’anciennement la substance du chrême se p… 	C’est encore l’opinion du petit peuple dans la Périgord, qu’anciennement la substance du chrême se prenait dans l’oreille du dragon, qu’un chevalier de la maison de Bourdeille allait cher- cher au-delà de Jerusalem, où il apportoit en suite cette substance, laquelle sanctifiée par les prélats du lieu, étoit distribuée dans les églises de la chrétiente.См. Слаще мирра и вина.
C’est faire comme le pourceau de St. Antoine. 	C’est faire comme le pourceau de St. Antoine (se fourrer partout).См. На шеромыжку.
C’est folie de manger cerises avec seigneurs. 	См. С сильным не борись, а с богатым не тяжись.
C’est fouet gref et félou… 	См. Сам на себя плеть вьет.
C’est jus vert ou verjus, bonnet blanc et blanc bonnet. 	См. Что ел, что кушал!.
C’est la chanson de ricochet. 	См. Старая погудка на новый лад.
C’est la chanson du ricochet. 	См. Пета бяху — стара песня!.
C’est la perle des hommes. 	См. Перл.
C’est la plus belle rose de son chapeau. 	См. Жемчужина.
C’est le bouc émissaire. 	См. Козел отпущения.
C’est le fils de la poule blanche. 	См. Барской курицы племянник.
C’est le grand moment. 	См. Момент решающий, подходящий.
C’est le jour le plus perdu où l’on n’a pas ri. 	См. День я потерял.
C’est le secret de la comédie. 	См. Секрет — на весь свет.
C’est le ton, qui fait la musique. 	C’est le ton, qui fait la musique (la chanson).См. По словам и голос.
C’est le ventre de ma mère, on n’y retourne plus. 	См. Не перерожать стать невесту тебе, какова есть.
C’est le ventre qui fait les révolutions. 	См. Брюхо.
C’est l’âne du moulin. 	См. На бедного Макара и шишки валятся.
C’est l’arche de Noë, toutes sortes des bêtes y font leur demeure. 	См. Ноев ковчег.
C’est l’oeuf de Colombe. 	См. Яйца на носок не поставит.
C’est mal achat de chat en sac. 	См. За-очи коня не купят.
C’est marché comme de paille. 	См. Дешевле пареной репы.
C’est mon faible. 	См. Слабость.
C’est posseder les biens que savoir s’en passer. 	См. Тот и богат, кто нужды не знает.
C’est pour moi de l’hébreu. 	См. Китайская грамота.
C’est promettre beaucoup, mais qu’en sort-il souvent? 	См. Гора мышь родила.
C’est sa passion. 	См. Пасия.
Dem ist gleich geschehen, als sei er zu Rom gewesen und hab den babst nit gesehen. 	См. Быть в Риме — и не видать Папы.
Dem Mimen flicht die Nachwelt keine Kränze. 	См. Венец.
Dem mutigen hilft Gott. 	См. Смелым Бог владает.
Dem Peter nehmen und dem Paul geben. 	См. Со Спаса дерет, да на Николу кладет.
Dem Wind und dem Narren lass seinen Lauf. 	См. За ветром в поле не угоняешься.Dem Wind und dem Narren lass seinen Lauf.См. Собака лает, ветер носит.
Dem, der sich weise dünkt, dem sag’ auf’s leiseste:… 	См. Блажен — не тот, кто всех умнее, Но тот, кто, будучи глупцом, Себя считает мудрецом.
Demitto auriculas, ut iniquae mentis asellus. 	См. И ухом не ведет.
Demivierge. 	См. Полудевственница.
Demüthiger Mönch, hoffärtiger Abt. 	См. Натореет крестьянская овца, лучше боярской козы обрыкается.
Den Abt reiten lassen. 	Den Abt reiten lassen (wenn der Abt ausgeritten ist, so machen sich die Mönche zu Hause lustig).См. Без Кота Мышам раздолье.
Den alten hört man schmerzhaft sagen… 	См. Теперь уж я не тот.
Den Baum erkennt man nach den Früchten. 	См. Дерево познается по плоду, а человек от дел.
Den Bock melken. 	См. Переливать из пустого в порожнее.
Den Bock zum Gärtner machen. 	См. Козла пустить в огород.
Den gestrigen Tag suchen. 	См. Вчерашнего дня искать.
