Напустить на себя дурь 	Напустить на себя дурь (иноск.) прикинуться не понимающимъ, несмыслящимъ, глупымъ.Ср. Напустить на себя дурь — иногда полезно умному человѣку; недаромъ говоритъ Эсхилъ, что казаться глупымъ — счастливая тайна мудрыхъ: въ этомъ не нуждается только тотъ, кто самъ по себѣ — дурень; ему и такъ, по извѣстной пословицѣ, — всегда везетъ.*** Афоризмы.См. Дуракам счастье. См. Везет.
Нарасхват 	Нарасхватъ — расхватать, усиленно (вперебой) разобрать.Ср. Рожновъ прибѣжалъ объявить, что книга «Лучи и тѣни» имѣетъ неслыханный успѣхъ: ее берутъ нарасхватъ.Григоровичъ. Порф. Петр. Кукушкинъ. 7.
Нарезаться 	Нарѣзаться (иноск.) напиться.Ср. (Баринъ) ему полное довѣріе оказываетъ, а онъ будетъ водку воровски пить, да еще нарѣжется.Боборыкинъ. Василій Теркинъ. 2, 22.Ср. Ну, ну, однако, вы, ребята, нарѣзались?... Чѣмъ же это вы такъ угостились?...Лѣсковъ. Соборяне. 3, 6.Ср. Борьба за существованіе кончается у него непремѣнно тѣмъ, что нарѣжется онъ какъ стелька пьянымъ.Маркевичъ. Марина изъ Алаго-рога. 2.Ср. (Съ Ноздревымъ) въ собраніи... какая-нибудь исторія непремѣнно происходила: или выведутъ его подъ руки изъ зала жандармы, или принуждены бываютъ вытолкать свои же пріятели... или нарѣжется въ буфетѣ...Гоголь. Мертвыя души. 1, 4.См. Борьба за существование. См. Как стелька пьян. См. История. См. Буфет.
Наркотический(аромат) 	Наркотическій (ароматъ), одуряющій, усыпляющій.Ср. Знойный блескъ солнца, наркотическіе ароматы парка и задумчивыя лунныя ночи — все это возбуждало въ душѣ мечтательную лѣнь.М. Горькій. Варенька Олесова. 2.Ср. Секретарь ... читалъ (обвинительный актъ) ... не повышая и не понижая голоса ... ему вторила вентиляція, неугомонно жужжавшая за судейскимъ столомъ, и въ общемъ получался звукъ, придававшій зальной тишинѣ усыпляющій наркотическій характеръ.А. П. Чеховъ. Въ сумеркахъ. Въ судѣ.Ср. Наркотинъ — ядъ, добываемый изъ опіума.Ср. ναρκωτικός (ναρκάω — цѣпенѣть) — усыпительное, одуряющее.См. Ароматный. См. Задумчивая ночь. См. Возвысить голос.
Народ 	Народъ (иноск.) люди извѣстнаго рода, — сорта; человѣкъ, принадлежащій къ извѣстному сорту людей.Ср. «Мастеровой людъ народъ избалованный».Ср. «Съ этимъ народцемъ, съ дворовыми, не легко управиться».Ср. «Что съ этимъ народомъ подѣлаешь?!»Ср. Volk.
Нарост 	На́ростъ (иноск.) нежелательное, вредное прибавленіе къ чему (намекъ на болѣзненные наросты — возвышенія на животныхъ и растеніяхъ или наростъ — въ горномъ дѣлѣ, накипь изъ гари).Ср. Каждый листокъ этой русской газеты, Москвы, донельзя наполненъ такими безобразными наростами (иностранными словами, въ родѣ «элаборатъ»).В. И. Даль. Искаженіе русскаго языка.
Наружный вид обманчив 	Наружный видъ обманчивъ.По наружности человѣка не суди.И толстъ, да простъ, и не тѣленъ, да дѣленъ.
Нарцисс 	Нарциссъ (иноск.) человѣкъ себялюбивый, безсердечный (только въ себя влюбленный).Ср. Человѣкъ, занятый самосозерцаніемъ, всегда нѣсколько похожъ... на Нарцисса.М. Горькій. Еще о чортѣ.Ср. Какъ же было поручить составленіе духовной такому шалопаю, красавчику, Нарциссу?П. Боборыкинъ. Китай-городъ. 2, 16.Ср. Нарциссъ собственной чернильницы — c’est le Narcisse de l’encrier.Ѳ. И. Тютчевъ о Кн. Горчаковѣ. (Ср. Григоровичъ. Литерат. воспом. 14.)Ср. Бѣги ея: она любила страстноИ любитъ страстно — самое себя,И, какъ Нарциссъ, терзается напрасно,И, какъ Нарциссъ, увянетъ, все любя.Л.
Мей. „Беги ея“.Ср. Der Mensch ist ein wahrer Narciss, er bespiegelt sich überall gerne selbst, er legt sich als Folie der ganzen Welt unter.Göthe. Wahlverwandtschaften.Поясн. Нарциссъ (греч. миѳ.), красавецъ; гордясь своей красотой, онъ съ пренебреженіемъ относился къ любившимъ его. Увидѣвъ свой образъ въ ручьѣ, онъ влюбился въ него, не замѣтивъ, что это онъ самъ; онъ умеръ отъ любовной тоски, какъ Эхо, которая, влюбившись въ него — умерла, снѣдаемая горемъ. Боги превратили его въ цвѣтокъ (Нарциссъ), который нерѣдко съ поникшей головой, какъ бы любуясь собой, смотрится въ свѣтлый ручей.См. Шалопай. См. Эхо. См. Терзаться. См. Вянуть.
Наряжаться, что баба на Юрья 	Наряжаться, что баба на Юрья (иноск.) о долгихъ дамскихъ (женскихъ) сборахъ, сопряженныхъ съ опаздываніемъ (намекъ на преданіе о несбывшихся сборахъ бабки съ внукомъ перейти въ Юрьевъ день отъ одного помѣщика къ другому).См. Вот, тебе, бабушка, и Юрьев день.
Нас было двое, брат и я... 	Насъ было двое, братъ и я ... (иноск. шут.) о семьѣ, въ которой братья дѣльцы и — одинъ другого стоитъ ...Ср. Насъ было двое, братъ и я,Въ товарищи себѣ мы взялиБулатный ножъ, да темну ночь;Забыли робость и печали,А совѣсть отогнали прочь.А. С. Пушкинъ. Братья разбойники.Ср. Par nobile fratrum.Пер. Благородная пара братьевъ (хорошая парочка)!Hor. Sat. 2, 3, 243.
Насандалить нос 	Насандалить носъ (иноск.) насандалиться, напиться пьянымъ (намекъ на красный сандалъ).Ср. Пьянюшкинъ, отставной квартальный,Исправно насандаливъ носъ,Въ худой шинелишкѣ, зимой, въ большой морозъ,По улицѣ шелъ утромъ и шатался.А. Е. Измайловъ. Пьяница.Ср. А отъ чего у васъ такъ красенъ носъ?«Пилъ бѣлое вино-съ!»
Насвистаться 	Насвистаться (иноск.) напиться до пьяна.Насвистался, какъ нѣмецъ.Ср. Заняли комнату и заказали ужинъ и... насвистались, да такъ насвистались, что мнѣ стало казаться, что мы оба уже и лыка не вяжемъ.Лѣсковъ. Смѣхъ и горе. 88.Ср. Непутный!... Тоже чаю! Не въ коня кормъ!... Алексѣюшка, продолжала она, обращаясь къ лохматому — пригляди хоть ты за нимъ... Не подпускай ты его къ тому столу (съ водками), не то вѣдь разомъ насвищется.П. И. Мельниковъ. Въ лѣсахъ. 1, 11.См. Лыка не вяжет. См. Не в коня корм.
Насиженное место 	Насиженное мѣсто (иноск.) пригрѣтое, привычное, выгодное (съ которымъ не хочется разстаться).Ср. ...(Въ комитетахъ)Тамъ, дѣйствительно, люди засѣлиСъ среднимъ чиномъ, безъ лентъ и безъ звѣздъ,А иные тузы полетѣлиВъ то же время съ насиженныхъ мѣстъ.Некрасовъ. Недальнее время. 4.См. Туз.
Насильно мил(люб) не будешь 	Насильно милъ (любъ) не будешь.На-силу не быть милу.
Насквозь всего знать(видеть) 	Насквозь всего знать (видѣть).Знаютъ Ѳоку и сзади, и съ боку.
Наслажденье изменяет 	Наслажденье измѣняетъ.Ср. Будьте увѣрены, что Колумбъ былъ счастливъ не тогда, когда открылъ Америку, а когда открывалъ ее.Достоевскій. Идіотъ. 3, 5.Ср. «Такъ наслажденье измѣняетъ!»Вздохнувши, я сказалъ,«Пока не тронуто — блистаетъ;Дотронься — блескъ пропалъ».
Наследник глазами плачется, а сердцем смеется 	(Наслѣдникъ) глазами плачется, а сердцемъ смѣется.Ср. «Глазами плачетъ, а сердцемъ смѣется». (Посл.)Ср.           Мой наслѣдникъ...Укравъ ключи у трупа моего,Онъ сундуки со смѣхомъ отопретъ.А. С. Пушкинъ. Скупой рыцарь. 2.Ср. Въ Египтѣ встарину велось обыкновенье,Когда кого хотятъ пышнѣе хоронить,Наемныхъ плакальщицъ пускать за гробомъ выть.Крыловъ. Похороны.Ср. Wann Erben reicher Leute die Augen wässrig machen —Sind solcher Leute Thränen nur Thränen von dem Lachen.Die Römer brauchten Weiber, die weinten für das Geld.Ob’s nicht mit manchen Erben sich ebenso verhält?Ср. Logau.
Lachende Erben.Ср. Freu dich liebes Mütlein, traure schwarzes Hütlein, heisst’s bei lachenden Erben.Otto. Evangel. Krankentrost (1664), pag. 1034.Ср. Deuil joyeux.Ср. Gli uomini dimenticano piuttosto la morte del padre che la perdita del patrimonio.Machiavelli. Il Principe. 17.Ср. Heredis fletus sub persona risus est.Пер. Плачъ наслѣдника — замаскированный смѣхъ.Publ. Syrus. Sententiae.Ср. Sic flet heres, ut puella nupta viro; utriusque fletus non apparens risus.Пер. Наслѣдникъ, какъ невѣста плачетъ; обоихъ плачъ — скрытый смѣхъ.Varro. Sententiæ.Ср. Plerique enim lacrimas fundunt; et toties siccos oculos habent, quoties spectator defuit.Пер. Многіе проливаютъ слезы на показъ; и такъ же скоро глаза у нихъ высыхаютъ, какъ скоро некому на нихъ смотрѣть.Senec. Tranquill. 15.Ср. На похоронахъ богатыхъ все есть кромѣ людей, которые бы сожалѣли о нихъ. (Китайск. посл.)Ср. Paul Perny. Prov. Chinois.См. Показные слезы.
Не ладно скроен, да крепко сшит 	Не ладно скроенъ, да крѣпко сшитъ.Ср. Ты Хлопко-Косолапъ! «Косолапъ и есть. Не ладно скроенъ, да крѣпко сшитъ. Побываешь въ моихъ лапахъ — узнаешь меня!»Гр. А. Толстой. Царь Борисъ. 2.Ср. Какъ взглянулъ (Чичиковъ) на его спину — широкую, какъ у вятскихъ приземистыхъ лошадей, и на ноги его, походившія на чугунныя тумбы на тротуарахъ — не могъ не воскликнуть внутренно: наградилъ тебя Богъ! Вотъ ужъ точно, какъ говорятъ, не ладно скроенъ, да крѣпко сшитъ!...Гоголь. Мертвыя души. 1, 5 (о Собакевичѣ).См. Тротуар.
Не лапоть сплести 	Не лапоть сплести (иноск.) не легко, не бездѣлица.Ср. Продать большой домъ въ маленькомъ городкѣ — не лапоть сплести.Мельниковъ. На горахъ. 4, 4.См. Это не блин спечь.
Не левой ногой сморкается 	Не лѣвой ногой сморкается (а какъ слѣдуетъ) (иноск.) — знаетъ свое дѣло.И мы не на руку лапоть надѣваемъ (иноск.) — говоритъ бывалый, смѣтливый, тонкій.Ср. Il ne se mouche pas du pied.Ср. Il n’est pas manchot (mancus, съ недостатками — однорукій), онъ не глупъ.Ср. Il n’est pas du temps qu’on se mouchait sur la manche.Ср. Emunctae naris homo.Horat. Sat. 1, 4, 8.Поясн. Emunctae naris — противоположное: muccosis naribus (morveux).См. Мы не так уж глупы.
Не ломайся овсяник, не быть калачем 	Не ломайся овсяникъ, не быть калачемъ (иноск.) не желай малый казаться важнѣе чѣмъ онъ есть.Ср. Не ломайся овсяникъ, не быть калачемъ, сказалъ Иванъ; и этому была участь не завиднѣе перваго ...Даль. Сказка о Иванѣ, молодомъ сержантѣ.См. Ломаться. См. Не быть медведю стадоводником, а свинье огороднином.
Не лошадь везет, овес едет 	Не лошадь везетъ, овесъ ѣдетъ.Не конь бѣжитъ, а кормъ дрочитъ.Не вымемъ молоко корова даетъ, а рыломъ
Не лыком шит 	Не лыкомъ шитъ (иноск.) — не простъ.Парчу лыкомъ не шьютъ.Ср. Когда онъ понялъ, что для современнаго администратора ничего больше не требуется, кромѣ свободныхъ манеръ, то тотчасъ же сообразилъ, что и онъ въ этомъ отношеніи не лыкомъ шитъ.Салтыковъ. Помпадуры. 9.См. Лыком шит. См. Администрация. См. Манера.
Не люби(друга) потаковщика, люби встречника 	Не люби (друга) потаковщика, люби встрѣчника.Ср. Отойди лучше отъ меня прочь: я не люблю друга потаковщика, а лучше люблю друга стрѣчника, и ты мнѣ соблазнъ.Лѣсковъ. Захудалый родъ. 1, 2.См. Поддакивать.
Не любишь?! 	Не любишь?! (иноск.) не нравится тебѣ — моя правда?!Ср. Табачищемъ закурили небось?... «Не любишь?»... сказалъ Ергушовъ.Гр. Л. Н. Толстой. Казаки. 13.Ср. Ай не любишь? ха-ха-ха, издѣвается отецъ съ сіяющимъ побѣдою лицомъ.Гл. Успенскій. Разоренье. Наблюденія одного лѣнтяя.Ср. А подъ судъ за взятки попасть хочешь? Не любишь? Конечно!... кому подъ судъ попасть хочется.Салтыковъ. Сказки. Игруш. дѣла людишки.См. На дыбы. См. Взятка.
Не любо не слушай, а лгать(верить) не мешай 	Не любо не слушай, а лгать (вѣрить) не мѣшай.Красно поле рожью, а рѣчь ложью (краснобайствомъ).Ср. Развѣ сказкуДоговорить, что давѣ начинали?Да съ уговоромъ: не любо — не слушай,Лгать не мѣшай!
Не место человека красит, но человек место 	Не мѣсто человѣка краситъ, но человѣкъ мѣсто.Ср. Никакое состояніе не можетъ безчестить человѣка, но человѣкъ можетъ безчестить свое состояніе.Кн. А. А. Безбородко.Ср. Не мѣсто добродѣтели, но добродѣтель мѣсто можетъ украсити (Плутархъ).Ср. Рукописн. уставы М. Н. Мясникова XVII в. къ тропнику Иннокентія и Стоглаву 1551 г.Ср. Homo locum ornat, non ornat hominem locus.Пер. Человѣкъ краситъ мѣсто, не мѣсто человѣка.Charis. p. 287, 15 K.Ср. Οὐχ ὁ τόπος τὸν ἄνδρα, ἀλλ’ ὁ ἀνὴρ αὐτὸν ἔντιμον ποιεῖ.Apost. 13, 62. Ср. Plutarch. apopht. Lac. Agesil. 6.Ср. Οὐχ ἡ πόλις σου το γένος εὐγενὲς ποιεῖ,Σὺ δ’ εὐγενέζεις τὴν πόλιν πράττων καλῶς.Пер. Не городъ твой родъ прославляетъ, но ты прославляешь городъ хорошими дѣяніями.Philemon. (4 в. до Р. Х. fr. 180.)
Не мечите бисера перед свиньями, да не попрут его ногами 	Не мечите бисера передъ свиньями, да не попрутъ его ногами (иноск.) — не тратьте словъ съ людьми, которые не могутъ, или не хотятъ васъ понять.Ср. Такого-то-де семинариста отъ всякаго ученія уволить: писано бо есть: не мечите бисера передъ свиньями, да не попрутъ его ногами.Фонвизинъ. Недоросль. 2, 5.Ср. Первый признакъ умнаго человѣка, — съ перваго взгляда знать, съ кѣмъ имѣетъ дѣло, и не метать бисера передъ Репетиловыми и тому подобными.А. С. Пушкинъ. Замѣтки.Ср. Perlen muss man nicht vor die Säue werfen.Пер. Pearls are ill valued by hungry swine.Пер. Il ne faut pas semer des marguerites devant les pourceaux.Ср. Не давайте святыни псамъ и не бросайте жемчуга вашего передъ свиньями, чтобъ онѣ не попрали его ногами своими ...Матѳ. 7, 6.Ср. Въ уши глупаго не говори, потому что онъ презритъ разумныя слова твои.Притч. Сол. 23, 9.См. Смыслен, как осел к волынке.
Не мил и вольный свет, когда милого друга нет 	Не милъ и вольный свѣтъ, когда милаго друга нѣтъ.Ср. «Гдѣ друга нѣтъ, тамъ цѣлый свѣтъПостылъ
Не многое, но много 	Не многое, но много (немножко по количеству, но содержательно).Ср. Lasst das buntschäckige Lesen. Aeolus liess nur den einzigen Wind wehen, der Odysseus an’s Ziel führen sollte, die übrigen band er.Niebuhr. (О чтеніи съ разборомъ.)Ср. Dominedio ci salvida i libri troppo lunghi e da i poemi!Lorenzo. Stecchetti (Olindo Guerrini). A Felice Cavalotti.Ср. Non multa sed multum.Ср. Pauca sed bona.Ср. Ajunt multum legendum esse, non multa.Plin. jun. (62—113). Ep. 7, 9.Ср. Non refert quam multos, sed quam bonos habeas (libros).Пер. Польза не во многихъ, но хорошихъ книгахъ.Sen. Ep. 45.Ср. Distrahit animum librorum multitudo.Sen. Ep. 2.Ср. Fastidientis est stomachi multa degustare.Тамъ же.Ср. Multa magis quam multorum lectione formanda mens.Пер. Умъ больше развивается, когда читать много, но не многое.Quintil. 10, 1, 59.Ср. Μέγα βιβλίον, μέγα κακόν.Callimach.
Не могу знать! 	Не могу знать! (примѣръ осторожнаго отвѣта.)Ср. Немогузнайка.Ср. Подъ діалектикомъ разумѣлъ Семенъ Семенычъ, отчасти такого, который на какой-нибудь оффиціальный вопросъ осмѣливается откликнуться! «Не могу знать».Салтыковъ. Невинные разсказы. 2.Ср. Къ «немогузнайкамъ» онъ обращался такъ: что вы мнѣ тамъ доносите и два и три? Вы должны сказать мнѣ прямо: или два, или три: служба не терпитъ этой неопредѣленности...Тамъ же.См. Диалектика. См. Официальный.
Не можем 	Не можемъ. Нельзя!Ср. Нельзя! твердятъ сыны коснѣнья;Но въ человѣческой грудиКъ чему-жъ сей лозунгъ Провидѣнья:«Трудись, надѣйся и гряди»!Кн. П. А. Вяземскій. У страха глаза велики.Ср. Non possumus.Поясн. Папа Климентъ VII (1523—1534) этимъ словомъ отказалъ Англійскому Королю Генриху VIII въ разводѣ его съ Екатериной Аррагонской для вступленія его въ бракъ съ Анною Болейнъ; съ тѣхъ поръ слово это означаетъ — отказъ. Это же слово повторилъ Пій IX 8-го февр. 1860 г. въ отвѣтъ Наполеону III объ уступкѣ папскихъ земель Итальянскому королю.Ср. (Священники и Саддукеи), призвавши ихъ, приказали имъ отнюдь не говорить и не учить о имени Іисуса. Но Петръ и Іоаннъ сказали имъ въ отвѣтъ: мы не можемъ не говорить того, что видѣли и слышали.Дѣянія Апост. 4, 18—20.См. Лозунг. См. Провиденциальное.
Не море топит корабли, а ветры 	Не море топитъ корабли, а вѣтры (иноск.) о пагубномъ вліяніи страстей.Ср. Не море топитъ корабли, а вѣтры.Даніилъ Заточникъ.См. Не вино винит, вина.
Не мудрено: подай! а мудреней того: где взять? 	Не мудрено: подай! а мудренѣй того: гдѣ взять? (иноск.) — не трудно выдумать налогъ, — труднѣе дать возможность внести его.Ср. Non est de pastu ovium quaestio, sed de lana.Пер. Не спрашиваютъ о пастбищѣ овецъ, а о шерсти ихъ.Pius II (1458—1464).Ср. Unde habeas quærit nemo: sed oportet habere.Juvenal. Sat. 14, 207.См. На деньгах нет знаку.
